{
  "$schema": "https://json-schema.org/draft/2020-12/schema",
  "$id": "acquisition_result.schema.json",
  "title": "AcquisitionResult v1",
  "type": "object",
  "additionalProperties": false,
  "required": ["contractVersion", "taskId", "executionId", "status", "candidates", "queriesAttempted", "errors", "limits", "fixtureMetadata"],
  "properties": {
    "contractVersion": {"const": "acquisition-result-v1"},
    "taskId": {"type": "string", "minLength": 1, "maxLength": 200, "pattern": "^[^/]+$"},
    "executionId": {"type": "string", "minLength": 1, "maxLength": 200, "pattern": "^[^/]+$"},
    "status": {"enum": ["completed", "partial", "no_candidates", "failed"]},
    "candidates": {"type": "array", "maxItems": 3, "items": {"$ref": "candidate_source.schema.json"}},
    "queriesAttempted": {"type": "array", "maxItems": 20, "items": {"type": "string", "maxLength": 500}},
    "errors": {"type": "array", "maxItems": 20, "items": {"type": "object", "additionalProperties": false, "required": ["code", "message"], "properties": {"code": {"type": "string", "minLength": 1, "maxLength": 100}, "message": {"type": "string", "minLength": 1, "maxLength": 500}}}},
    "limits": {"type": "object", "additionalProperties": false, "required": ["maximumCandidates", "maximumTotalVisibleTextBytes"], "properties": {"maximumCandidates": {"const": 3}, "maximumTotalVisibleTextBytes": {"const": 393216}}},
    "fixtureMetadata": {"oneOf": [{"type": "null"}, {"$ref": "candidate_source.schema.json#/$defs/fixtureMetadata"}]}
  },
  "allOf": [
    {"if": {"required": ["status"], "properties": {"status": {"const": "no_candidates"}}}, "then": {"properties": {"candidates": {"type": "array", "maxItems": 0}}}},
    {"if": {"required": ["status"], "properties": {"status": {"const": "completed"}}}, "then": {"properties": {"candidates": {"type": "array", "minItems": 1}}}}
  ]
}
