{"contractVersion":"acquisition-result-v1","taskId":"TEST_FIXTURE_TASK_001","executionId":"TEST_FIXTURE_EXECUTION_001","status":"partial","candidates":[{"contractVersion":"candidate-source-v1","taskId":"TEST_FIXTURE_TASK_001","executionId":"TEST_FIXTURE_EXECUTION_001","sourceId":"34991052e3058acd369672f5e4d7715391c6f66c4615c2761345664ea01e3224","sourceUrl":"https://example.com/test-fixture/blocked","canonicalUrl":"https://example.com/test-fixture/blocked","sourcePlatform":"example_fixture","pageTitle":null,"sellerName":null,"productTitle":null,"price":null,"currency":null,"country":null,"city":null,"searchQuery":null,"acquisitionMethod":"manual_seed","discoveredAt":"2026-07-18T00:00:00.000Z","acquisitionStatus":"blocked","legalBasis":"public_source","robotsPolicy":"blocked","errorCode":"robots_blocked","fixtureMetadata":{"marker":"TEST_FIXTURE","isTestFixture":true,"productionEligible":false,"scenario":"blocked"}}],"queriesAttempted":[],"errors":[{"code":"robots_blocked","message":"TEST_FIXTURE source is blocked by policy."}],"limits":{"maximumCandidates":3,"maximumTotalVisibleTextBytes":393216},"fixtureMetadata":{"marker":"TEST_FIXTURE","isTestFixture":true,"productionEligible":false,"scenario":"blocked"}}
